round_id,round_desc
1,"Dignissim vel, consequat justo sed ac id pharetra non sed. Integer elit fames est commodo arcu pharetra id cras. Ut ac odio lobortis, arcu sed orci mo"
2,"Senectus nisi luctus, nibh quisque per eleifend semper in molestie. Vestibulum tempus praesent. Commodo interdum eget ut magna laoreet nascetur. Natoq"
3,"Mauris egestas nec nec. Elementum, augue cras ridiculus a sollicitudin lorem ac non. Ipsum suspendisse ut natoque montes ac dapibus, faucibus. Ac nequ"
4,"Per diam et in libero tempor sed. Ac, metus tempor nunc platea velit egestas. Blandit nisi ac consequat blandit, ac tempus rhoncus suscipit maecenas p"
5,"Augue nunc nulla, tristique habitasse lacus. Cubilia sodales enim sed venenatis id. Rutrum tempus sem aliquam, dui neque, erat. Inceptos nam dapibus e"
